{
  "commodity": {
    "desc": "SOYBEANS",
    "slug": "soybeans"
  },
  "county": {
    "code": "025",
    "name": "CALHOUN"
  },
  "schema_version": 2,
  "series": [
    {
      "canonical": true,
      "class": "ALL CLASSES",
      "prodn_practice": "ALL PRODUCTION PRACTICES",
      "raw": {},
      "short_desc": "SOYBEANS - YIELD, MEASURED IN BU / ACRE",
      "suppressed": {},
      "unit": "BU / ACRE",
      "util_practice": "ALL UTILIZATION PRACTICES",
      "values": {
        "1942": 15.9,
        "1943": 15.4,
        "1944": 8.9,
        "1945": 14.1,
        "1946": 8.5,
        "1947": 7.6,
        "1948": 13.5,
        "1949": 20.0,
        "1950": 15.3,
        "1951": 15.5,
        "1952": 16.0,
        "1953": 13.0,
        "1954": 16.0,
        "1955": 17.2,
        "1956": 19.4,
        "1957": 18.2,
        "1958": 16.9,
        "1959": 22.2,
        "1960": 15.7,
        "1961": 23.6,
        "1962": 17.1,
        "1963": 17.6,
        "1964": 19.4,
        "1965": 22.2,
        "1966": 18.9,
        "1967": 16.0,
        "1968": 26.0,
        "1969": 19.5,
        "1970": 23.0,
        "1971": 19.0,
        "1972": 21.0,
        "1973": 22.5,
        "1974": 15.6,
        "1975": 26.5,
        "1976": 19.8,
        "1977": 34.0,
        "1978": 24.6,
        "1979": 30.9,
        "1980": 34.2,
        "1981": 29.7,
        "1982": 30.0,
        "1983": 28.0,
        "1984": 21.0,
        "1985": 27.4,
        "1986": 30.1,
        "1987": 34.0,
        "1988": 27.9,
        "1989": 31.2,
        "1990": 40.2,
        "1991": 38.4,
        "1992": 36.1,
        "1993": 38.6,
        "1994": 40.7,
        "1995": 41.0,
        "1996": 28.0,
        "1997": 40.0,
        "1998": 44.0,
        "1999": 34.0,
        "2000": 39.0,
        "2001": 35.0,
        "2002": 39.0,
        "2003": 30.0,
        "2004": 42.0,
        "2005": 34.0,
        "2006": 43.0,
        "2007": 40.0,
        "2008": 27.5,
        "2009": 39.0,
        "2010": 47.7,
        "2011": 45.8,
        "2012": 32.0,
        "2013": 49.2,
        "2014": 39.0,
        "2015": 44.5,
        "2016": 50.2,
        "2017": 35.2,
        "2018": 44.5,
        "2019": 35.8,
        "2020": 43.1,
        "2021": 46.0,
        "2022": 48.9,
        "2023": 42.2,
        "2024": 44.5,
        "2025": 44.1
      }
    }
  ],
  "state": {
    "alpha": "MI",
    "fips": "26",
    "name": "MICHIGAN"
  }
}
