{
  "commodity": {
    "desc": "WHEAT",
    "slug": "wheat"
  },
  "county": {
    "code": "061",
    "name": "DUBUQUE"
  },
  "schema_version": 2,
  "series": [
    {
      "canonical": true,
      "class": "ALL CLASSES",
      "prodn_practice": "ALL PRODUCTION PRACTICES",
      "raw": {},
      "short_desc": "WHEAT - YIELD, MEASURED IN BU / ACRE",
      "suppressed": {},
      "unit": "BU / ACRE",
      "util_practice": "ALL UTILIZATION PRACTICES",
      "values": {
        "1973": 38.2,
        "1976": 32.1,
        "1978": 32.0,
        "1979": 42.0,
        "1981": 46.0,
        "1982": 39.6,
        "1985": 53.0,
        "1987": 40.0,
        "1988": 31.0,
        "1989": 55.3,
        "1990": 44.7,
        "1991": 38.0,
        "1992": 40.0,
        "1993": 15.6,
        "1994": 52.0,
        "1995": 36.0,
        "1996": 22.7,
        "1997": 30.0
      }
    },
    {
      "class": "WINTER",
      "prodn_practice": "ALL PRODUCTION PRACTICES",
      "raw": {},
      "short_desc": "WHEAT, WINTER - YIELD, MEASURED IN BU / ACRE",
      "suppressed": {},
      "unit": "BU / ACRE",
      "util_practice": "ALL UTILIZATION PRACTICES",
      "values": {
        "1973": 38.2,
        "1976": 32.1,
        "1978": 32.0,
        "1979": 42.0,
        "1981": 46.0,
        "1982": 39.6,
        "1985": 53.0,
        "1987": 40.0,
        "1988": 31.0,
        "1989": 55.3,
        "1990": 44.7,
        "1991": 38.0,
        "1992": 40.0,
        "1993": 15.6,
        "1994": 52.0,
        "1995": 36.0,
        "1996": 22.7,
        "1997": 30.0
      }
    }
  ],
  "state": {
    "alpha": "IA",
    "fips": "19",
    "name": "IOWA"
  }
}
