{
  "commodity": {
    "desc": "CORN",
    "slug": "corn"
  },
  "county": {
    "code": "097",
    "name": "KIOWA"
  },
  "schema_version": 2,
  "series": [
    {
      "canonical": true,
      "class": "ALL CLASSES",
      "prodn_practice": "ALL PRODUCTION PRACTICES",
      "raw": {},
      "short_desc": "CORN, GRAIN - YIELD, MEASURED IN BU / ACRE",
      "suppressed": {},
      "unit": "BU / ACRE",
      "util_practice": "GRAIN",
      "values": {
        "1958": 31.0,
        "1959": 26.0,
        "1960": 32.0,
        "1961": 30.0,
        "1962": 36.0,
        "1963": 35.0,
        "1964": 17.0,
        "1965": 20.0,
        "1966": 24.0,
        "1967": 72.0,
        "1968": 83.0,
        "1969": 75.0,
        "1970": 71.0,
        "1971": 78.0,
        "1972": 131.0,
        "1973": 121.0,
        "1974": 95.0,
        "1975": 88.0,
        "1976": 99.0,
        "1977": 114.0,
        "1978": 104.0,
        "1979": 131.0,
        "1980": 100.0,
        "1981": 148.0,
        "1982": 140.0,
        "1983": 116.0,
        "1984": 158.0,
        "1985": 151.0,
        "1986": 155.0,
        "1987": 132.0,
        "1988": 164.0,
        "1989": 163.0,
        "1990": 160.6,
        "1991": 156.3,
        "1992": 180.6,
        "1993": 147.4,
        "1994": 162.0,
        "1995": 155.0,
        "1996": 179.0,
        "1997": 180.0,
        "1998": 134.0,
        "1999": 147.0,
        "2000": 154.0,
        "2001": 121.0,
        "2002": 171.0,
        "2003": 178.0,
        "2004": 171.0,
        "2005": 170.0,
        "2006": 157.0,
        "2007": 179.0,
        "2010": 163.5,
        "2012": 173.0,
        "2013": 183.3,
        "2014": 202.6,
        "2020": 192.3,
        "2021": 183.2,
        "2022": 147.9,
        "2023": 139.8
      }
    },
    {
      "class": "ALL CLASSES",
      "prodn_practice": "ALL PRODUCTION PRACTICES",
      "raw": {},
      "short_desc": "CORN, SILAGE - YIELD, MEASURED IN TONS / ACRE",
      "suppressed": {},
      "unit": "TONS / ACRE",
      "util_practice": "SILAGE",
      "values": {
        "1970": 12.0,
        "1971": 10.0,
        "1972": 21.0,
        "1973": 18.0,
        "1974": 14.9,
        "1975": 14.3,
        "1976": 10.4,
        "1977": 12.9,
        "1978": 12.9,
        "1979": 11.9,
        "1981": 16.5,
        "1982": 20.7,
        "1984": 16.0,
        "1986": 21.0,
        "1987": 20.0,
        "1988": 14.9,
        "1989": 17.5,
        "1990": 17.5,
        "1991": 15.9,
        "1992": 17.1,
        "1993": 12.8,
        "1994": 18.0,
        "1995": 17.1,
        "1996": 10.0,
        "1997": 15.8,
        "1998": 19.3,
        "1999": 15.6,
        "2000": 16.0,
        "2002": 13.0,
        "2004": 14.3
      }
    },
    {
      "class": "ALL CLASSES",
      "prodn_practice": "IRRIGATED",
      "raw": {},
      "short_desc": "CORN, GRAIN, IRRIGATED - YIELD, MEASURED IN BU / ACRE",
      "suppressed": {},
      "unit": "BU / ACRE",
      "util_practice": "GRAIN",
      "values": {
        "1972": 131.0,
        "1973": 122.0,
        "1974": 110.0,
        "1975": 99.0,
        "1976": 105.0,
        "1977": 114.0,
        "1978": 106.0,
        "1979": 132.0,
        "1980": 100.0,
        "1981": 148.0,
        "1982": 144.0,
        "1983": 126.0,
        "1984": 159.0,
        "1985": 160.0,
        "1986": 157.0,
        "1987": 136.0,
        "1988": 168.0,
        "1989": 164.0,
        "1990": 162.4,
        "1991": 158.0,
        "1992": 181.2,
        "1993": 153.1,
        "1994": 167.0,
        "1995": 162.0,
        "1996": 185.0,
        "1997": 195.0,
        "1998": 173.0,
        "1999": 170.0,
        "2000": 166.0,
        "2001": 174.0,
        "2002": 185.0,
        "2003": 195.0,
        "2004": 185.0,
        "2005": 186.0,
        "2006": 186.0,
        "2010": 182.6,
        "2012": 184.8,
        "2013": 194.6,
        "2014": 210.7
      }
    },
    {
      "class": "ALL CLASSES",
      "prodn_practice": "NON-IRRIGATED",
      "raw": {},
      "short_desc": "CORN, GRAIN, NON-IRRIGATED - YIELD, MEASURED IN BU / ACRE",
      "suppressed": {},
      "unit": "BU / ACRE",
      "util_practice": "GRAIN",
      "values": {
        "1973": 40.0,
        "1974": 20.0,
        "1975": 45.0,
        "1976": 32.0,
        "1978": 25.0,
        "1979": 60.0,
        "1980": 70.0,
        "1982": 38.0,
        "1983": 50.0,
        "1984": 35.0,
        "1985": 71.0,
        "1986": 61.0,
        "1987": 54.0,
        "1988": 60.0,
        "1989": 47.0,
        "1990": 28.5,
        "1991": 32.0,
        "1992": 52.0,
        "1993": 50.8,
        "1994": 42.0,
        "1995": 50.0,
        "1996": 50.0,
        "1997": 86.0,
        "1998": 44.0,
        "1999": 74.0,
        "2000": 76.0,
        "2001": 23.0,
        "2002": 22.0,
        "2003": 23.0,
        "2004": 63.0,
        "2005": 55.0,
        "2006": 28.0,
        "2010": 76.7,
        "2012": 36.1,
        "2013": 50.4,
        "2014": 119.6
      }
    }
  ],
  "state": {
    "alpha": "KS",
    "fips": "20",
    "name": "KANSAS"
  }
}
