{
  "commodity": {
    "desc": "SOYBEANS",
    "slug": "soybeans"
  },
  "county": {
    "code": "079",
    "name": "HENRY"
  },
  "schema_version": 2,
  "series": [
    {
      "canonical": true,
      "class": "ALL CLASSES",
      "prodn_practice": "ALL PRODUCTION PRACTICES",
      "raw": {},
      "short_desc": "SOYBEANS - YIELD, MEASURED IN BU / ACRE",
      "suppressed": {},
      "unit": "BU / ACRE",
      "util_practice": "ALL UTILIZATION PRACTICES",
      "values": {
        "1947": 12.0,
        "1948": 15.0,
        "1949": 11.6,
        "1950": 14.0,
        "1951": 14.0,
        "1952": 14.0,
        "1953": 10.0,
        "1954": 8.0,
        "1955": 14.0,
        "1956": 13.5,
        "1957": 19.6,
        "1958": 20.9,
        "1959": 23.5,
        "1960": 22.0,
        "1961": 23.0,
        "1962": 23.0,
        "1963": 26.0,
        "1964": 24.9,
        "1965": 25.0,
        "1966": 25.0,
        "1967": 27.0,
        "1968": 22.0,
        "1969": 25.0,
        "1970": 22.0,
        "1971": 27.0,
        "1972": 24.0,
        "1973": 21.0,
        "1974": 25.0,
        "1975": 26.0,
        "1976": 23.0,
        "1977": 25.0,
        "1978": 24.0,
        "1979": 25.0,
        "1980": 17.0,
        "1981": 27.0,
        "1982": 29.0,
        "1983": 13.0,
        "1984": 22.0,
        "1985": 33.0,
        "1986": 25.0,
        "1987": 21.0,
        "1988": 22.0,
        "1989": 26.0,
        "1990": 30.0,
        "1991": 30.0,
        "1992": 37.0,
        "1993": 35.0,
        "1994": 39.0,
        "1995": 37.0,
        "1996": 35.0,
        "1997": 37.0,
        "1998": 32.0,
        "1999": 16.0,
        "2000": 27.0,
        "2001": 36.0,
        "2002": 34.0,
        "2003": 46.0,
        "2004": 43.0,
        "2005": 42.0,
        "2006": 41.0,
        "2007": 15.0,
        "2008": 21.5,
        "2009": 46.5,
        "2010": 23.4,
        "2011": 30.1,
        "2012": 35.3,
        "2013": 49.2,
        "2014": 44.6,
        "2015": 43.6,
        "2016": 48.5,
        "2017": 50.5,
        "2018": 48.1,
        "2019": 48.9,
        "2020": 52.6,
        "2021": 45.7,
        "2022": 43.0,
        "2023": 45.6,
        "2024": 46.4
      }
    }
  ],
  "state": {
    "alpha": "TN",
    "fips": "47",
    "name": "TENNESSEE"
  }
}
