{
  "commodity": {
    "desc": "CORN",
    "slug": "corn"
  },
  "county": {
    "code": "011",
    "name": "BUREAU"
  },
  "schema_version": 2,
  "series": [
    {
      "canonical": true,
      "class": "ALL CLASSES",
      "prodn_practice": "ALL PRODUCTION PRACTICES",
      "raw": {},
      "short_desc": "CORN, GRAIN - YIELD, MEASURED IN BU / ACRE",
      "suppressed": {},
      "unit": "BU / ACRE",
      "util_practice": "GRAIN",
      "values": {
        "1925": 45.0,
        "1926": 39.0,
        "1927": 38.0,
        "1928": 47.0,
        "1929": 43.0,
        "1930": 36.0,
        "1931": 42.0,
        "1932": 51.0,
        "1933": 40.0,
        "1934": 26.0,
        "1935": 46.0,
        "1936": 37.0,
        "1937": 59.0,
        "1938": 49.0,
        "1939": 61.0,
        "1940": 52.0,
        "1941": 63.0,
        "1942": 66.0,
        "1943": 62.0,
        "1944": 60.0,
        "1945": 52.0,
        "1946": 62.0,
        "1947": 50.0,
        "1948": 66.0,
        "1949": 62.0,
        "1950": 58.0,
        "1951": 62.0,
        "1952": 71.0,
        "1953": 66.0,
        "1954": 67.0,
        "1955": 68.0,
        "1956": 77.0,
        "1957": 76.0,
        "1958": 79.0,
        "1959": 78.0,
        "1960": 78.0,
        "1961": 86.0,
        "1962": 88.0,
        "1963": 90.0,
        "1964": 85.0,
        "1965": 99.0,
        "1966": 98.0,
        "1967": 106.0,
        "1968": 95.0,
        "1969": 113.0,
        "1970": 69.0,
        "1971": 111.0,
        "1972": 110.0,
        "1973": 111.0,
        "1974": 85.0,
        "1975": 124.0,
        "1976": 106.0,
        "1977": 120.0,
        "1978": 117.0,
        "1979": 127.0,
        "1980": 113.0,
        "1981": 136.0,
        "1982": 133.0,
        "1983": 93.0,
        "1984": 131.0,
        "1985": 135.0,
        "1986": 135.0,
        "1987": 132.0,
        "1988": 67.0,
        "1989": 113.0,
        "1990": 124.0,
        "1991": 128.0,
        "1992": 145.0,
        "1993": 133.0,
        "1994": 166.0,
        "1995": 126.0,
        "1996": 149.0,
        "1997": 130.0,
        "1998": 161.0,
        "1999": 139.0,
        "2000": 151.0,
        "2001": 169.0,
        "2002": 163.0,
        "2003": 175.0,
        "2004": 186.0,
        "2005": 136.0,
        "2006": 178.0,
        "2007": 195.0,
        "2008": 199.0,
        "2009": 176.0,
        "2010": 166.7,
        "2011": 177.3,
        "2012": 145.7,
        "2013": 185.9,
        "2014": 196.0,
        "2015": 196.8,
        "2016": 203.9,
        "2017": 215.4,
        "2018": 214.1,
        "2019": 179.9,
        "2020": 199.4,
        "2021": 203.5,
        "2022": 225.1,
        "2023": 223.5,
        "2024": 240.8,
        "2025": 225.9
      }
    },
    {
      "class": "ALL CLASSES",
      "prodn_practice": "ALL PRODUCTION PRACTICES",
      "raw": {},
      "short_desc": "CORN, GRAIN - YIELD, MEASURED IN BU / NET PLANTED ACRE",
      "suppressed": {},
      "unit": "BU / NET PLANTED ACRE",
      "util_practice": "GRAIN",
      "values": {
        "1984": 131.0,
        "1985": 135.0
      }
    }
  ],
  "state": {
    "alpha": "IL",
    "fips": "17",
    "name": "ILLINOIS"
  }
}
