{
  "commodity": {
    "desc": "CORN",
    "slug": "corn"
  },
  "county": {
    "code": "113",
    "name": "MADISON"
  },
  "schema_version": 2,
  "series": [
    {
      "canonical": true,
      "class": "ALL CLASSES",
      "prodn_practice": "ALL PRODUCTION PRACTICES",
      "raw": {},
      "short_desc": "CORN, GRAIN - YIELD, MEASURED IN BU / ACRE",
      "suppressed": {},
      "unit": "BU / ACRE",
      "util_practice": "GRAIN",
      "values": {
        "1955": 31.0,
        "1956": 25.5,
        "1957": 27.9,
        "1958": 35.5,
        "1959": 36.5,
        "1960": 38.0,
        "1961": 46.0,
        "1962": 40.0,
        "1963": 49.0,
        "1964": 47.0,
        "1965": 56.0,
        "1966": 47.0,
        "1967": 58.0,
        "1968": 46.0,
        "1969": 32.0,
        "1970": 35.0,
        "1971": 52.0,
        "1972": 52.0,
        "1973": 49.0,
        "1974": 49.0,
        "1975": 58.0,
        "1976": 79.0,
        "1977": 62.0,
        "1978": 66.0,
        "1979": 79.0,
        "1980": 45.0,
        "1981": 79.0,
        "1982": 89.0,
        "1983": 42.0,
        "1984": 89.0,
        "1985": 107.0,
        "1986": 78.0,
        "1987": 91.0,
        "1988": 74.0,
        "1989": 104.0,
        "1990": 92.0,
        "1991": 64.0,
        "1992": 109.0,
        "1993": 74.0,
        "1994": 116.0,
        "1995": 101.0,
        "1996": 108.0,
        "1997": 107.0,
        "1998": 82.0,
        "1999": 98.0,
        "2000": 107.0,
        "2001": 105.0,
        "2002": 99.0,
        "2003": 123.0,
        "2004": 134.0,
        "2005": 120.0,
        "2006": 117.0,
        "2007": 88.0,
        "2008": 133.0,
        "2009": 148.0,
        "2010": 115.9,
        "2011": 133.9,
        "2012": 101.9,
        "2014": 185.8,
        "2015": 149.4,
        "2016": 170.0,
        "2017": 156.3,
        "2018": 173.9,
        "2019": 193.0,
        "2020": 176.2,
        "2021": 169.8,
        "2022": 129.6,
        "2023": 177.8,
        "2024": 184.0,
        "2025": 170.5
      }
    },
    {
      "class": "ALL CLASSES",
      "prodn_practice": "ALL PRODUCTION PRACTICES",
      "raw": {},
      "short_desc": "CORN, GRAIN - YIELD, MEASURED IN BU / NET PLANTED ACRE",
      "suppressed": {},
      "unit": "BU / NET PLANTED ACRE",
      "util_practice": "GRAIN",
      "values": {
        "1983": 41.0
      }
    }
  ],
  "state": {
    "alpha": "TN",
    "fips": "47",
    "name": "TENNESSEE"
  }
}
