{
  "commodity": {
    "desc": "CORN",
    "slug": "corn"
  },
  "county": {
    "code": "145",
    "name": "PERSON"
  },
  "schema_version": 2,
  "series": [
    {
      "canonical": true,
      "class": "ALL CLASSES",
      "prodn_practice": "ALL PRODUCTION PRACTICES",
      "raw": {},
      "short_desc": "CORN, GRAIN - YIELD, MEASURED IN BU / ACRE",
      "suppressed": {},
      "unit": "BU / ACRE",
      "util_practice": "GRAIN",
      "values": {
        "1925": 11.0,
        "1926": 18.0,
        "1927": 19.0,
        "1928": 16.0,
        "1929": 19.0,
        "1930": 15.0,
        "1931": 20.0,
        "1932": 12.0,
        "1933": 16.0,
        "1934": 16.0,
        "1935": 16.0,
        "1936": 19.0,
        "1937": 20.0,
        "1938": 19.0,
        "1939": 19.0,
        "1940": 21.0,
        "1941": 21.0,
        "1942": 21.0,
        "1943": 20.0,
        "1944": 20.0,
        "1945": 26.0,
        "1946": 26.0,
        "1947": 28.0,
        "1948": 32.0,
        "1949": 31.0,
        "1950": 35.0,
        "1951": 28.0,
        "1952": 23.0,
        "1953": 17.0,
        "1954": 20.0,
        "1955": 29.0,
        "1956": 34.0,
        "1957": 21.0,
        "1958": 37.0,
        "1959": 30.0,
        "1960": 35.0,
        "1961": 37.0,
        "1962": 40.0,
        "1963": 39.0,
        "1964": 42.0,
        "1965": 45.0,
        "1966": 25.0,
        "1967": 55.0,
        "1968": 45.0,
        "1969": 48.0,
        "1970": 41.0,
        "1971": 36.0,
        "1972": 58.0,
        "1973": 61.0,
        "1974": 52.0,
        "1975": 60.0,
        "1976": 46.0,
        "1977": 25.0,
        "1978": 62.0,
        "1979": 60.0,
        "1980": 44.0,
        "1981": 84.0,
        "1982": 87.0,
        "1983": 40.0,
        "1984": 81.0,
        "1985": 67.0,
        "1986": 41.0,
        "1987": 40.0,
        "1988": 52.0,
        "1989": 91.0,
        "1990": 78.0,
        "1991": 56.0,
        "1992": 90.0,
        "1993": 50.0,
        "1994": 90.0,
        "1995": 120.0,
        "1996": 87.0,
        "1997": 75.0,
        "1998": 77.0,
        "1999": 70.0,
        "2000": 96.0,
        "2001": 85.0,
        "2002": 53.0,
        "2003": 100.0,
        "2004": 120.0,
        "2005": 73.0,
        "2006": 121.0,
        "2007": 48.0,
        "2008": 71.0,
        "2009": 98.0,
        "2010": 53.8,
        "2011": 55.0,
        "2012": 52.8,
        "2013": 115.7,
        "2014": 107.0,
        "2016": 168.6,
        "2017": 123.0,
        "2018": 95.7,
        "2019": 67.0,
        "2020": 92.5,
        "2021": 136.4,
        "2022": 117.0,
        "2023": 107.8,
        "2024": 61.7,
        "2025": 141.6
      }
    },
    {
      "class": "ALL CLASSES",
      "prodn_practice": "ALL PRODUCTION PRACTICES",
      "raw": {},
      "short_desc": "CORN, GRAIN - YIELD, MEASURED IN BU / NET PLANTED ACRE",
      "suppressed": {},
      "unit": "BU / NET PLANTED ACRE",
      "util_practice": "GRAIN",
      "values": {
        "1978": 60.9,
        "1979": 58.8,
        "1981": 82.8,
        "1982": 83.4,
        "1983": 34.8,
        "1984": 80.0,
        "1985": 64.8
      }
    },
    {
      "class": "ALL CLASSES",
      "prodn_practice": "ALL PRODUCTION PRACTICES",
      "raw": {},
      "short_desc": "CORN, SILAGE - YIELD, MEASURED IN TONS / ACRE",
      "suppressed": {},
      "unit": "TONS / ACRE",
      "util_practice": "SILAGE",
      "values": {
        "1991": 15.0,
        "1992": 18.0,
        "1993": 9.0,
        "1994": 18.0,
        "1995": 23.0,
        "1996": 11.0,
        "1997": 13.0,
        "1998": 6.0,
        "1999": 10.0,
        "2000": 11.0,
        "2001": 22.0,
        "2002": 8.0,
        "2003": 18.0,
        "2004": 16.0
      }
    }
  ],
  "state": {
    "alpha": "NC",
    "fips": "37",
    "name": "NORTH CAROLINA"
  }
}
