{
  "commodity": {
    "desc": "SOYBEANS",
    "slug": "soybeans"
  },
  "county": {
    "code": "071",
    "name": "HENDERSON"
  },
  "schema_version": 2,
  "series": [
    {
      "canonical": true,
      "class": "ALL CLASSES",
      "prodn_practice": "ALL PRODUCTION PRACTICES",
      "raw": {},
      "short_desc": "SOYBEANS - YIELD, MEASURED IN BU / ACRE",
      "suppressed": {},
      "unit": "BU / ACRE",
      "util_practice": "ALL UTILIZATION PRACTICES",
      "values": {
        "1927": 17.0,
        "1928": 14.0,
        "1929": 18.0,
        "1930": 17.0,
        "1931": 19.0,
        "1932": 22.0,
        "1933": 19.0,
        "1934": 16.0,
        "1935": 17.0,
        "1936": 14.0,
        "1937": 18.0,
        "1938": 21.0,
        "1939": 25.0,
        "1940": 21.0,
        "1941": 20.0,
        "1942": 21.0,
        "1943": 23.0,
        "1944": 23.0,
        "1945": 20.0,
        "1946": 25.0,
        "1947": 18.0,
        "1948": 24.5,
        "1949": 26.0,
        "1950": 27.0,
        "1951": 26.0,
        "1952": 29.0,
        "1953": 25.5,
        "1954": 24.5,
        "1955": 28.5,
        "1956": 27.5,
        "1957": 27.5,
        "1958": 26.0,
        "1959": 26.0,
        "1960": 25.5,
        "1961": 30.0,
        "1962": 28.5,
        "1963": 30.5,
        "1964": 27.0,
        "1965": 27.5,
        "1966": 29.5,
        "1967": 31.5,
        "1968": 31.5,
        "1969": 37.5,
        "1970": 35.5,
        "1971": 35.0,
        "1972": 39.5,
        "1973": 35.0,
        "1974": 29.0,
        "1975": 35.5,
        "1976": 35.0,
        "1977": 38.5,
        "1978": 39.0,
        "1979": 42.0,
        "1980": 35.5,
        "1981": 39.0,
        "1982": 40.0,
        "1983": 33.5,
        "1984": 36.0,
        "1985": 42.0,
        "1986": 43.0,
        "1987": 40.0,
        "1988": 32.5,
        "1989": 36.0,
        "1990": 43.5,
        "1991": 50.0,
        "1992": 45.0,
        "1993": 45.5,
        "1994": 54.5,
        "1995": 42.0,
        "1996": 49.0,
        "1997": 51.5,
        "1998": 52.0,
        "1999": 45.0,
        "2000": 46.0,
        "2001": 50.0,
        "2002": 49.0,
        "2003": 38.0,
        "2004": 51.0,
        "2005": 46.0,
        "2006": 50.0,
        "2007": 49.0,
        "2008": 51.0,
        "2009": 48.0,
        "2010": 49.3,
        "2011": 55.3,
        "2012": 55.4,
        "2013": 51.9,
        "2014": 52.7,
        "2015": 57.3,
        "2016": 57.8,
        "2017": 61.6,
        "2018": 60.2,
        "2020": 62.1,
        "2021": 66.6,
        "2022": 67.2,
        "2023": 66.0,
        "2025": 69.6
      }
    }
  ],
  "state": {
    "alpha": "IL",
    "fips": "17",
    "name": "ILLINOIS"
  }
}
