{
  "commodity": {
    "desc": "SOYBEANS",
    "slug": "soybeans"
  },
  "county": {
    "code": "105",
    "name": "MONROE"
  },
  "schema_version": 2,
  "series": [
    {
      "canonical": true,
      "class": "ALL CLASSES",
      "prodn_practice": "ALL PRODUCTION PRACTICES",
      "raw": {},
      "short_desc": "SOYBEANS - YIELD, MEASURED IN BU / ACRE",
      "suppressed": {},
      "unit": "BU / ACRE",
      "util_practice": "ALL UTILIZATION PRACTICES",
      "values": {
        "1937": 13.1,
        "1938": 14.6,
        "1939": 10.0,
        "1940": 13.4,
        "1941": 20.1,
        "1942": 14.7,
        "1943": 14.5,
        "1944": 17.5,
        "1945": 18.2,
        "1946": 17.8,
        "1947": 14.7,
        "1948": 21.9,
        "1949": 16.0,
        "1950": 16.6,
        "1951": 16.4,
        "1952": 18.1,
        "1953": 16.8,
        "1954": 17.5,
        "1955": 18.4,
        "1956": 19.9,
        "1957": 20.8,
        "1958": 22.8,
        "1959": 24.4,
        "1960": 26.0,
        "1961": 23.3,
        "1962": 24.3,
        "1963": 21.8,
        "1964": 22.9,
        "1965": 24.3,
        "1966": 24.6,
        "1967": 26.5,
        "1968": 27.6,
        "1969": 29.8,
        "1970": 29.1,
        "1971": 27.3,
        "1972": 21.7,
        "1973": 28.5,
        "1974": 24.6,
        "1975": 30.6,
        "1976": 29.9,
        "1977": 31.2,
        "1978": 32.3,
        "1979": 30.0,
        "1980": 32.4,
        "1981": 28.2,
        "1982": 30.8,
        "1983": 27.0,
        "1984": 27.1,
        "1985": 31.2,
        "1986": 34.9,
        "1987": 32.3,
        "1988": 26.9,
        "1989": 33.0,
        "1990": 37.6,
        "1991": 35.7,
        "1992": 38.2,
        "1993": 40.4,
        "1994": 39.9,
        "1995": 34.8,
        "1996": 31.3,
        "1997": 38.0,
        "1998": 34.3,
        "1999": 31.4,
        "2000": 47.9,
        "2001": 45.8,
        "2002": 32.5,
        "2003": 32.0,
        "2004": 44.0,
        "2005": 46.6,
        "2006": 39.9,
        "2007": 33.4,
        "2008": 38.0,
        "2009": 45.5,
        "2010": 37.4,
        "2011": 37.0,
        "2012": 32.1,
        "2014": 51.4,
        "2015": 48.6,
        "2016": 52.2,
        "2017": 45.8,
        "2018": 44.7,
        "2020": 51.3,
        "2021": 48.9,
        "2022": 55.1,
        "2023": 52.8,
        "2024": 56.0
      }
    }
  ],
  "state": {
    "alpha": "IN",
    "fips": "18",
    "name": "INDIANA"
  }
}
