{
  "commodity": {
    "desc": "WHEAT",
    "slug": "wheat"
  },
  "county": {
    "code": "037",
    "name": "DAVIDSON"
  },
  "schema_version": 2,
  "series": [
    {
      "canonical": true,
      "class": "ALL CLASSES",
      "prodn_practice": "ALL PRODUCTION PRACTICES",
      "raw": {},
      "short_desc": "WHEAT - YIELD, MEASURED IN BU / ACRE",
      "suppressed": {},
      "unit": "BU / ACRE",
      "util_practice": "ALL UTILIZATION PRACTICES",
      "values": {
        "1948": 15.0,
        "1949": 14.9,
        "1950": 13.0,
        "1951": 16.5,
        "1952": 21.5,
        "1953": 21.0,
        "1954": 15.5,
        "1955": 15.5,
        "1956": 22.0,
        "1957": 17.1,
        "1958": 20.0,
        "1959": 21.3,
        "1960": 23.0,
        "1961": 22.0,
        "1962": 21.0,
        "1963": 24.0,
        "1964": 18.0,
        "1965": 18.0,
        "1966": 18.0,
        "1967": 19.0,
        "1968": 19.0,
        "1969": 39.0,
        "1970": 37.0,
        "1971": 35.0,
        "1972": 28.0,
        "1973": 30.0,
        "1974": 25.0,
        "1975": 35.0,
        "1976": 36.0,
        "1977": 38.0,
        "1978": 33.0,
        "1979": 35.0,
        "1980": 35.0,
        "1981": 44.0,
        "1982": 26.0,
        "1983": 22.0,
        "1984": 31.0,
        "1985": 30.0,
        "1986": 25.0,
        "1987": 25.0,
        "1988": 41.0,
        "1989": 37.0,
        "1990": 36.0,
        "1991": 29.0,
        "1992": 40.0,
        "2006": 42.0
      }
    },
    {
      "class": "ALL CLASSES",
      "prodn_practice": "ALL PRODUCTION PRACTICES",
      "raw": {},
      "short_desc": "WHEAT - YIELD, MEASURED IN BU / NET PLANTED ACRE",
      "suppressed": {},
      "unit": "BU / NET PLANTED ACRE",
      "util_practice": "ALL UTILIZATION PRACTICES",
      "values": {
        "1972": 22.7,
        "1973": 23.1,
        "1974": 21.6,
        "1975": 28.0,
        "1976": 30.0,
        "1977": 28.8,
        "1978": 25.0,
        "1979": 28.0,
        "1980": 29.5,
        "1981": 42.0,
        "1982": 22.0,
        "1983": 16.0,
        "1984": 25.0,
        "1985": 21.0,
        "1986": 19.0,
        "1987": 17.0,
        "1988": 28.0,
        "1989": 24.0,
        "1990": 29.0
      }
    },
    {
      "class": "WINTER",
      "prodn_practice": "ALL PRODUCTION PRACTICES",
      "raw": {},
      "short_desc": "WHEAT, WINTER - YIELD, MEASURED IN BU / ACRE",
      "suppressed": {},
      "unit": "BU / ACRE",
      "util_practice": "ALL UTILIZATION PRACTICES",
      "values": {
        "1948": 15.0,
        "1949": 14.9,
        "1950": 13.0,
        "1951": 16.5,
        "1952": 21.5,
        "1953": 21.0,
        "1954": 15.5,
        "1955": 15.5,
        "1956": 22.0,
        "1957": 17.1,
        "1958": 20.0,
        "1959": 21.3,
        "1960": 23.0,
        "1961": 22.0,
        "1962": 21.0,
        "1963": 24.0,
        "1964": 18.0,
        "1965": 18.0,
        "1966": 18.0,
        "1967": 19.0,
        "1968": 19.0,
        "1969": 39.0,
        "1970": 37.0,
        "1971": 35.0,
        "1972": 28.0,
        "1973": 30.0,
        "1974": 25.0,
        "1975": 35.0,
        "1976": 36.0,
        "1977": 38.0,
        "1978": 33.0,
        "1979": 35.0,
        "1980": 35.0,
        "1981": 44.0,
        "1982": 26.0,
        "1983": 22.0,
        "1984": 31.0,
        "1985": 30.0,
        "1986": 25.0,
        "1987": 25.0,
        "1988": 41.0,
        "1989": 37.0,
        "1990": 36.0,
        "1991": 29.0,
        "1992": 40.0,
        "2006": 42.0
      }
    },
    {
      "class": "WINTER",
      "prodn_practice": "ALL PRODUCTION PRACTICES",
      "raw": {},
      "short_desc": "WHEAT, WINTER - YIELD, MEASURED IN BU / NET PLANTED ACRE",
      "suppressed": {},
      "unit": "BU / NET PLANTED ACRE",
      "util_practice": "ALL UTILIZATION PRACTICES",
      "values": {
        "1972": 22.7,
        "1973": 23.1,
        "1974": 21.6,
        "1975": 28.0,
        "1976": 30.0,
        "1977": 28.8,
        "1978": 25.0,
        "1979": 28.0,
        "1980": 29.5,
        "1981": 42.0,
        "1982": 22.0,
        "1983": 16.0,
        "1984": 25.0,
        "1985": 21.0,
        "1986": 19.0,
        "1987": 17.0,
        "1988": 28.0,
        "1989": 24.0,
        "1990": 29.0
      }
    }
  ],
  "state": {
    "alpha": "TN",
    "fips": "47",
    "name": "TENNESSEE"
  }
}
