{
  "commodity": {
    "desc": "WHEAT",
    "slug": "wheat"
  },
  "county": {
    "code": "059",
    "name": "ISANTI"
  },
  "schema_version": 2,
  "series": [
    {
      "canonical": true,
      "class": "ALL CLASSES",
      "prodn_practice": "ALL PRODUCTION PRACTICES",
      "raw": {},
      "short_desc": "WHEAT - YIELD, MEASURED IN BU / ACRE",
      "suppressed": {},
      "unit": "BU / ACRE",
      "util_practice": "ALL UTILIZATION PRACTICES",
      "values": {
        "1921": 8.1,
        "1922": 14.2,
        "1923": 14.5,
        "1924": 24.7,
        "1925": 15.2,
        "1926": 16.0,
        "1927": 13.2,
        "1928": 15.0,
        "1929": 15.0,
        "1930": 16.1,
        "1931": 14.1,
        "1932": 13.2,
        "1933": 11.7,
        "1934": 9.1,
        "1935": 8.0,
        "1936": 11.4,
        "1937": 15.7,
        "1938": 14.0,
        "1939": 11.4,
        "1940": 18.0,
        "1941": 14.5,
        "1942": 19.3,
        "1943": 18.8,
        "1944": 9.5,
        "1945": 17.6,
        "1946": 17.6,
        "1947": 14.7,
        "1948": 13.0,
        "1949": 16.6,
        "1950": 12.4,
        "1951": 21.3,
        "1952": 14.5,
        "1953": 14.7,
        "1954": 11.2,
        "1955": 20.4,
        "1956": 21.8,
        "1957": 19.8,
        "1958": 22.3,
        "1959": 16.0,
        "1960": 21.2,
        "1961": 19.7,
        "1962": 25.0,
        "1963": 23.0,
        "1964": 22.7,
        "1965": 24.0,
        "1966": 20.2,
        "1967": 27.7,
        "1968": 22.0,
        "1969": 21.0,
        "1970": 21.7,
        "1971": 26.0,
        "1972": 25.0,
        "1973": 31.0,
        "1974": 25.3,
        "1975": 24.0,
        "1976": 25.2,
        "1977": 39.7,
        "1978": 26.8,
        "1979": 30.2,
        "1980": 31.2,
        "1981": 25.9,
        "1982": 30.1,
        "1983": 32.4,
        "1984": 28.5,
        "1985": 32.9,
        "1986": 30.2,
        "1987": 22.5,
        "1997": 28.0,
        "1998": 36.2,
        "1999": 41.8,
        "2002": 24.8,
        "2007": 28.9
      }
    },
    {
      "class": "ALL CLASSES",
      "prodn_practice": "ALL PRODUCTION PRACTICES",
      "raw": {},
      "short_desc": "WHEAT - YIELD, MEASURED IN BU / NET PLANTED ACRE",
      "suppressed": {},
      "unit": "BU / NET PLANTED ACRE",
      "util_practice": "ALL UTILIZATION PRACTICES",
      "values": {
        "1972": 25.0,
        "1973": 31.0,
        "1974": 25.3,
        "1975": 18.0,
        "1976": 25.2,
        "1977": 34.8,
        "1978": 26.8,
        "1979": 30.2,
        "1980": 31.2,
        "1981": 25.9,
        "1982": 30.1,
        "1983": 27.0,
        "1984": 28.5,
        "1985": 32.9,
        "1986": 30.2,
        "1987": 22.5
      }
    },
    {
      "class": "SPRING, (EXCL DURUM)",
      "prodn_practice": "ALL PRODUCTION PRACTICES",
      "raw": {},
      "short_desc": "WHEAT, SPRING, (EXCL DURUM) - YIELD, MEASURED IN BU / ACRE",
      "suppressed": {},
      "unit": "BU / ACRE",
      "util_practice": "ALL UTILIZATION PRACTICES",
      "values": {
        "1921": 8.0,
        "1922": 14.0,
        "1923": 15.0,
        "1924": 25.0,
        "1925": 15.0,
        "1926": 16.0,
        "1927": 13.0,
        "1928": 15.0,
        "1929": 15.0,
        "1930": 16.0,
        "1931": 14.0,
        "1932": 13.0,
        "1933": 11.0,
        "1934": 9.0,
        "1935": 7.0,
        "1936": 9.0,
        "1937": 11.0,
        "1938": 14.0,
        "1939": 8.0,
        "1940": 18.0,
        "1941": 10.0,
        "1942": 22.0,
        "1943": 18.0,
        "1944": 11.0,
        "1945": 19.0,
        "1946": 17.0,
        "1947": 12.0,
        "1948": 13.0,
        "1949": 15.0,
        "1950": 5.0,
        "1951": 12.1,
        "1952": 16.0,
        "1953": 10.0,
        "1954": 12.0,
        "1955": 19.0,
        "1956": 17.0,
        "1959": 17.0,
        "1960": 22.0,
        "1961": 18.0,
        "1962": 23.0,
        "1963": 23.0,
        "1964": 21.0,
        "1966": 19.0,
        "1967": 25.0,
        "1968": 25.0,
        "1969": 19.0,
        "1970": 19.0,
        "1971": 26.0,
        "1972": 25.0,
        "1973": 30.0,
        "1974": 26.0,
        "1975": 26.0,
        "1976": 24.0,
        "1977": 40.0,
        "1978": 27.0,
        "1979": 30.0,
        "1980": 30.6,
        "1981": 25.0,
        "1982": 29.0,
        "1985": 34.0,
        "1986": 31.0,
        "1997": 28.0,
        "2006": 38.0,
        "2007": 27.0,
        "2009": 31.5
      }
    },
    {
      "class": "SPRING, (EXCL DURUM)",
      "prodn_practice": "ALL PRODUCTION PRACTICES",
      "raw": {},
      "short_desc": "WHEAT, SPRING, (EXCL DURUM) - YIELD, MEASURED IN BU / NET PLANTED ACRE",
      "suppressed": {},
      "unit": "BU / NET PLANTED ACRE",
      "util_practice": "ALL UTILIZATION PRACTICES",
      "values": {
        "1972": 25.0,
        "1973": 30.0,
        "1974": 26.0,
        "1975": 13.0,
        "1976": 24.0,
        "1977": 34.3,
        "1978": 27.0,
        "1979": 30.0,
        "1980": 30.6,
        "1981": 25.0,
        "1982": 29.0,
        "1985": 34.0,
        "1986": 31.0
      }
    },
    {
      "class": "SPRING, DURUM",
      "prodn_practice": "ALL PRODUCTION PRACTICES",
      "raw": {},
      "short_desc": "WHEAT, SPRING, DURUM - YIELD, MEASURED IN BU / ACRE",
      "suppressed": {},
      "unit": "BU / ACRE",
      "util_practice": "ALL UTILIZATION PRACTICES",
      "values": {
        "1933": 12.0,
        "1934": 12.0,
        "1935": 15.0,
        "1939": 15.0,
        "1948": 12.0,
        "1949": 11.0,
        "1951": 20.0,
        "1952": 14.0,
        "1963": 23.0,
        "1964": 26.0,
        "1965": 24.0,
        "1966": 21.0,
        "1967": 33.0,
        "1968": 19.0,
        "1969": 23.0,
        "1970": 27.0,
        "1978": 27.0
      }
    },
    {
      "class": "SPRING, DURUM",
      "prodn_practice": "ALL PRODUCTION PRACTICES",
      "raw": {},
      "short_desc": "WHEAT, SPRING, DURUM - YIELD, MEASURED IN BU / NET PLANTED ACRE",
      "suppressed": {},
      "unit": "BU / NET PLANTED ACRE",
      "util_practice": "ALL UTILIZATION PRACTICES",
      "values": {
        "1978": 27.0
      }
    },
    {
      "class": "WINTER",
      "prodn_practice": "ALL PRODUCTION PRACTICES",
      "raw": {},
      "short_desc": "WHEAT, WINTER - YIELD, MEASURED IN BU / ACRE",
      "suppressed": {},
      "unit": "BU / ACRE",
      "util_practice": "ALL UTILIZATION PRACTICES",
      "values": {
        "1921": 10.0,
        "1922": 17.0,
        "1923": 10.0,
        "1924": 20.0,
        "1925": 20.0,
        "1926": 17.0,
        "1927": 25.0,
        "1928": 14.0,
        "1929": 16.0,
        "1930": 19.0,
        "1931": 16.0,
        "1932": 18.0,
        "1933": 15.0,
        "1934": 8.0,
        "1935": 23.0,
        "1936": 19.0,
        "1937": 19.0,
        "1938": 14.0,
        "1939": 13.0,
        "1940": 18.0,
        "1941": 15.0,
        "1942": 19.0,
        "1943": 19.0,
        "1944": 9.0,
        "1945": 17.0,
        "1946": 18.0,
        "1947": 16.0,
        "1948": 13.0,
        "1949": 19.0,
        "1950": 17.0,
        "1951": 25.0,
        "1952": 14.0,
        "1953": 16.0,
        "1954": 11.0,
        "1958": 22.0,
        "1960": 20.0,
        "1961": 21.0,
        "1962": 26.0,
        "1973": 32.0,
        "1974": 24.0,
        "1975": 23.0,
        "1976": 30.0,
        "1977": 38.0,
        "1978": 26.0,
        "1979": 31.0,
        "1980": 34.0,
        "1981": 26.8,
        "1985": 32.0,
        "2007": 35.0
      }
    },
    {
      "class": "WINTER",
      "prodn_practice": "ALL PRODUCTION PRACTICES",
      "raw": {},
      "short_desc": "WHEAT, WINTER - YIELD, MEASURED IN BU / NET PLANTED ACRE",
      "suppressed": {},
      "unit": "BU / NET PLANTED ACRE",
      "util_practice": "ALL UTILIZATION PRACTICES",
      "values": {
        "1973": 32.0,
        "1974": 24.0,
        "1975": 23.0,
        "1976": 30.0,
        "1977": 38.0,
        "1978": 26.0,
        "1979": 31.0,
        "1980": 34.0,
        "1981": 26.8,
        "1985": 32.0
      }
    }
  ],
  "state": {
    "alpha": "MN",
    "fips": "27",
    "name": "MINNESOTA"
  }
}
