{
  "commodity": {
    "desc": "SOYBEANS",
    "slug": "soybeans"
  },
  "county": {
    "code": "019",
    "name": "CHEROKEE"
  },
  "schema_version": 2,
  "series": [
    {
      "canonical": true,
      "class": "ALL CLASSES",
      "prodn_practice": "ALL PRODUCTION PRACTICES",
      "raw": {},
      "short_desc": "SOYBEANS - YIELD, MEASURED IN BU / ACRE",
      "suppressed": {},
      "unit": "BU / ACRE",
      "util_practice": "ALL UTILIZATION PRACTICES",
      "values": {
        "1949": 9.0,
        "1950": 10.0,
        "1951": 13.0,
        "1952": 17.0,
        "1953": 18.0,
        "1954": 9.0,
        "1955": 15.0,
        "1956": 16.0,
        "1957": 18.0,
        "1958": 17.0,
        "1959": 13.0,
        "1960": 20.0,
        "1961": 19.0,
        "1962": 18.0,
        "1963": 19.0,
        "1964": 22.0,
        "1965": 24.0,
        "1966": 27.0,
        "1967": 27.0,
        "1968": 25.0,
        "1969": 23.0,
        "1970": 23.0,
        "1971": 27.0,
        "1972": 19.4,
        "1973": 18.9,
        "1974": 23.0,
        "1975": 22.6,
        "1976": 24.0,
        "1977": 20.0,
        "1978": 24.7,
        "1979": 31.3,
        "1980": 15.0,
        "1981": 28.6,
        "1982": 29.8,
        "1983": 18.4,
        "1984": 22.8,
        "1985": 30.5,
        "1986": 17.9,
        "1987": 16.5,
        "1988": 26.7,
        "1989": 25.0,
        "1990": 15.7,
        "1991": 23.5,
        "1992": 28.1,
        "1993": 14.7,
        "1994": 36.4,
        "1995": 18.0,
        "1996": 36.0,
        "1997": 23.0,
        "1998": 22.0,
        "1999": 16.0,
        "2000": 17.0,
        "2001": 35.0,
        "2002": 24.0,
        "2003": 40.0,
        "2004": 40.0,
        "2005": 41.0,
        "2006": 15.0,
        "2007": 15.0,
        "2009": 43.0,
        "2010": 27.4,
        "2011": 30.4,
        "2012": 50.1,
        "2013": 45.9,
        "2014": 37.8,
        "2015": 30.3,
        "2016": 20.8,
        "2017": 42.1,
        "2018": 45.3,
        "2019": 30.1,
        "2020": 36.3,
        "2021": 45.1,
        "2022": 39.2,
        "2023": 51.6,
        "2024": 41.4
      }
    }
  ],
  "state": {
    "alpha": "AL",
    "fips": "01",
    "name": "ALABAMA"
  }
}
