{
  "commodity": {
    "desc": "CORN",
    "slug": "corn"
  },
  "county": {
    "code": "071",
    "name": "ONEIDA"
  },
  "schema_version": 2,
  "series": [
    {
      "canonical": true,
      "class": "ALL CLASSES",
      "prodn_practice": "ALL PRODUCTION PRACTICES",
      "raw": {},
      "short_desc": "CORN, GRAIN - YIELD, MEASURED IN BU / ACRE",
      "suppressed": {},
      "unit": "BU / ACRE",
      "util_practice": "GRAIN",
      "values": {
        "2004": 190.0
      }
    },
    {
      "class": "ALL CLASSES",
      "prodn_practice": "ALL PRODUCTION PRACTICES",
      "raw": {},
      "short_desc": "CORN, SILAGE - YIELD, MEASURED IN TONS / ACRE",
      "suppressed": {},
      "unit": "TONS / ACRE",
      "util_practice": "SILAGE",
      "values": {
        "1974": 15.0,
        "1975": 15.6,
        "1976": 17.6,
        "1977": 16.0,
        "1978": 17.1,
        "1979": 18.0,
        "1980": 16.5,
        "1981": 15.0,
        "1982": 16.0,
        "1983": 15.7,
        "1984": 17.1,
        "1985": 16.0,
        "2004": 20.0
      }
    }
  ],
  "state": {
    "alpha": "ID",
    "fips": "16",
    "name": "IDAHO"
  }
}
