{
  "commodity": {
    "desc": "CORN",
    "slug": "corn"
  },
  "county": {
    "code": "089",
    "name": "OTERO"
  },
  "schema_version": 2,
  "series": [
    {
      "canonical": true,
      "class": "ALL CLASSES",
      "prodn_practice": "ALL PRODUCTION PRACTICES",
      "raw": {},
      "short_desc": "CORN, GRAIN - YIELD, MEASURED IN BU / ACRE",
      "suppressed": {},
      "unit": "BU / ACRE",
      "util_practice": "GRAIN",
      "values": {
        "1963": 58.5,
        "1964": 71.0,
        "1965": 78.5,
        "1966": 57.5,
        "1967": 90.0,
        "1968": 83.5,
        "1969": 98.5,
        "1970": 95.0,
        "1971": 79.0,
        "1972": 102.0,
        "1973": 105.0,
        "1974": 88.4,
        "1975": 85.0,
        "1976": 105.0,
        "1977": 105.0,
        "1978": 116.0,
        "1979": 135.5,
        "1980": 75.5,
        "1981": 110.0,
        "1982": 113.0,
        "1983": 109.0,
        "1984": 120.0,
        "1985": 119.0,
        "1986": 134.0,
        "1987": 135.0,
        "1988": 142.0,
        "1989": 130.0,
        "1990": 140.0,
        "1991": 153.0,
        "1992": 172.5,
        "1993": 139.5,
        "1994": 160.5,
        "1995": 149.0,
        "1996": 168.0,
        "1997": 156.0,
        "1998": 153.5,
        "1999": 165.5,
        "2000": 162.5,
        "2001": 172.0,
        "2002": 124.5,
        "2003": 183.5,
        "2004": 200.0,
        "2005": 180.5,
        "2006": 228.5,
        "2007": 184.5,
        "2008": 186.0,
        "2010": 190.2,
        "2011": 174.8,
        "2012": 148.1,
        "2014": 191.8,
        "2016": 187.7,
        "2017": 171.7,
        "2018": 127.2,
        "2020": 182.0,
        "2022": 152.5,
        "2024": 130.0
      }
    },
    {
      "class": "ALL CLASSES",
      "prodn_practice": "ALL PRODUCTION PRACTICES",
      "raw": {},
      "short_desc": "CORN, GRAIN - YIELD, MEASURED IN BU / NET PLANTED ACRE",
      "suppressed": {},
      "unit": "BU / NET PLANTED ACRE",
      "util_practice": "GRAIN",
      "values": {
        "1975": 82.0,
        "1976": 102.0,
        "1977": 102.0,
        "1978": 107.5,
        "1979": 133.0,
        "1980": 74.5,
        "1981": 105.5,
        "1982": 110.0,
        "1983": 105.0,
        "1984": 119.0,
        "1985": 119.0
      }
    },
    {
      "class": "ALL CLASSES",
      "prodn_practice": "ALL PRODUCTION PRACTICES",
      "raw": {},
      "short_desc": "CORN, SILAGE - YIELD, MEASURED IN TONS / ACRE",
      "suppressed": {},
      "unit": "TONS / ACRE",
      "util_practice": "SILAGE",
      "values": {
        "1963": 15.0,
        "1964": 14.5,
        "1965": 19.0,
        "1966": 14.0,
        "1967": 21.0,
        "1968": 16.0,
        "1969": 16.5,
        "1970": 17.0,
        "1971": 16.0,
        "1986": 19.5,
        "1987": 19.0,
        "1988": 21.0,
        "1989": 17.0,
        "1990": 18.0,
        "1991": 19.0,
        "1992": 19.5,
        "1993": 19.0,
        "1994": 17.5,
        "1995": 22.5,
        "1996": 20.0,
        "1997": 18.0,
        "1998": 21.5,
        "1999": 19.0,
        "2000": 20.0,
        "2001": 21.5,
        "2002": 12.5,
        "2005": 16.5,
        "2006": 24.0,
        "2007": 24.0
      }
    },
    {
      "class": "ALL CLASSES",
      "prodn_practice": "IRRIGATED",
      "raw": {},
      "short_desc": "CORN, GRAIN, IRRIGATED - YIELD, MEASURED IN BU / ACRE",
      "suppressed": {},
      "unit": "BU / ACRE",
      "util_practice": "GRAIN",
      "values": {
        "1963": 58.5,
        "1964": 71.0,
        "1965": 79.0,
        "1966": 59.5,
        "1967": 90.0,
        "1968": 83.5,
        "1969": 100.0,
        "1970": 97.0,
        "1971": 80.0,
        "1972": 102.0,
        "1973": 105.0,
        "1974": 91.0,
        "1975": 88.0,
        "1976": 108.5,
        "1977": 105.0,
        "1978": 116.0,
        "1979": 135.5,
        "1980": 75.5,
        "1981": 111.5,
        "1982": 115.0,
        "1983": 110.5,
        "1984": 120.0,
        "1985": 119.0,
        "1986": 134.0,
        "1987": 135.0,
        "1988": 142.0,
        "1989": 130.0,
        "1990": 140.0,
        "1991": 153.0,
        "1992": 172.5,
        "1993": 139.5,
        "1994": 160.5,
        "1995": 149.0,
        "1996": 168.0,
        "1997": 158.5,
        "1998": 156.0,
        "1999": 165.5,
        "2000": 162.5,
        "2001": 172.0,
        "2002": 124.5,
        "2003": 183.5,
        "2004": 200.0,
        "2005": 180.5,
        "2006": 228.5,
        "2016": 187.7
      }
    },
    {
      "class": "ALL CLASSES",
      "prodn_practice": "IRRIGATED",
      "raw": {},
      "short_desc": "CORN, GRAIN, IRRIGATED - YIELD, MEASURED IN BU / NET PLANTED ACRE",
      "suppressed": {},
      "unit": "BU / NET PLANTED ACRE",
      "util_practice": "GRAIN",
      "values": {
        "1975": 84.5,
        "1976": 105.0,
        "1977": 102.0,
        "1978": 107.5,
        "1979": 133.5,
        "1980": 74.5,
        "1981": 108.5,
        "1982": 112.5,
        "1983": 107.0,
        "1984": 119.0,
        "1985": 119.0
      }
    },
    {
      "class": "ALL CLASSES",
      "prodn_practice": "IRRIGATED",
      "raw": {},
      "short_desc": "CORN, SILAGE, IRRIGATED - YIELD, MEASURED IN TONS / ACRE",
      "suppressed": {},
      "unit": "TONS / ACRE",
      "util_practice": "SILAGE",
      "values": {
        "1986": 19.5,
        "1987": 19.0,
        "1988": 21.0,
        "1989": 17.0,
        "1990": 18.0,
        "1991": 19.0,
        "1992": 19.5,
        "1993": 19.0,
        "1994": 17.5,
        "1995": 22.5,
        "1996": 20.0,
        "1997": 18.0,
        "1998": 21.5,
        "1999": 19.0,
        "2000": 20.0,
        "2001": 21.5,
        "2002": 12.5,
        "2005": 16.5,
        "2006": 24.0,
        "2007": 24.0
      }
    },
    {
      "class": "ALL CLASSES",
      "prodn_practice": "NON-IRRIGATED",
      "raw": {},
      "short_desc": "CORN, GRAIN, NON-IRRIGATED - YIELD, MEASURED IN BU / ACRE",
      "suppressed": {},
      "unit": "BU / ACRE",
      "util_practice": "GRAIN",
      "values": {
        "1963": 20.0,
        "1965": 14.0,
        "1966": 18.0,
        "1969": 12.0,
        "1970": 21.0,
        "1971": 21.0,
        "1974": 25.0,
        "1975": 16.0,
        "1976": 12.0,
        "1981": 25.0,
        "1982": 26.5,
        "1983": 26.5,
        "1997": 46.0,
        "1998": 60.0
      }
    },
    {
      "class": "ALL CLASSES",
      "prodn_practice": "NON-IRRIGATED",
      "raw": {},
      "short_desc": "CORN, GRAIN, NON-IRRIGATED - YIELD, MEASURED IN BU / NET PLANTED ACRE",
      "suppressed": {},
      "unit": "BU / NET PLANTED ACRE",
      "util_practice": "GRAIN",
      "values": {
        "1975": 16.0,
        "1976": 12.0,
        "1981": 12.5,
        "1982": 20.0,
        "1983": 20.0
      }
    }
  ],
  "state": {
    "alpha": "CO",
    "fips": "08",
    "name": "COLORADO"
  }
}
