{
  "commodity": {
    "desc": "SOYBEANS",
    "slug": "soybeans"
  },
  "county": {
    "code": "025",
    "name": "CASS"
  },
  "schema_version": 2,
  "series": [
    {
      "canonical": true,
      "class": "ALL CLASSES",
      "prodn_practice": "ALL PRODUCTION PRACTICES",
      "raw": {},
      "short_desc": "SOYBEANS - YIELD, MEASURED IN BU / ACRE",
      "suppressed": {},
      "unit": "BU / ACRE",
      "util_practice": "ALL UTILIZATION PRACTICES",
      "values": {
        "1960": 31.0,
        "1961": 27.0,
        "1962": 28.0,
        "1963": 28.0,
        "1964": 22.0,
        "1965": 23.0,
        "1966": 32.0,
        "1967": 27.0,
        "1968": 29.0,
        "1969": 36.0,
        "1970": 26.1,
        "1971": 30.0,
        "1972": 33.0,
        "1973": 32.0,
        "1974": 26.0,
        "1975": 25.1,
        "1976": 24.0,
        "1977": 32.0,
        "1978": 36.0,
        "1979": 33.1,
        "1980": 32.1,
        "1981": 38.0,
        "1982": 35.1,
        "1983": 32.1,
        "1984": 24.0,
        "1985": 36.1,
        "1986": 41.0,
        "1987": 35.1,
        "1988": 29.2,
        "1989": 30.1,
        "1990": 38.1,
        "1991": 39.1,
        "1992": 43.0,
        "1993": 36.0,
        "1994": 47.0,
        "1995": 26.7,
        "1996": 44.0,
        "1997": 41.0,
        "1998": 43.1,
        "1999": 42.0,
        "2000": 35.1,
        "2001": 40.0,
        "2002": 34.1,
        "2003": 33.1,
        "2004": 48.1,
        "2005": 47.1,
        "2006": 49.1,
        "2007": 50.1,
        "2008": 41.0,
        "2009": 52.0,
        "2010": 48.1,
        "2011": 52.2,
        "2012": 29.3,
        "2013": 46.5,
        "2014": 49.7,
        "2015": 53.7,
        "2016": 57.7,
        "2017": 52.1,
        "2018": 55.7,
        "2019": 52.5,
        "2020": 52.3,
        "2022": 38.9,
        "2023": 58.6,
        "2024": 54.6
      }
    },
    {
      "class": "ALL CLASSES",
      "prodn_practice": "IRRIGATED",
      "raw": {},
      "short_desc": "SOYBEANS, IRRIGATED - YIELD, MEASURED IN BU / ACRE",
      "suppressed": {},
      "unit": "BU / ACRE",
      "util_practice": "ALL UTILIZATION PRACTICES",
      "values": {
        "1963": 35.0,
        "1964": 27.0,
        "1968": 40.0,
        "1969": 40.0,
        "1970": 38.0,
        "1973": 36.0,
        "1974": 31.0,
        "1975": 34.0,
        "1976": 33.0,
        "1977": 36.0,
        "1978": 40.0,
        "1979": 40.0,
        "1980": 40.0,
        "1981": 45.0,
        "1982": 43.0,
        "1983": 43.0,
        "1985": 42.0,
        "1986": 43.0,
        "1987": 41.0,
        "1988": 45.0,
        "1989": 51.0,
        "1990": 47.0,
        "1991": 55.0,
        "1992": 45.0,
        "1993": 40.0,
        "1994": 50.0,
        "1995": 35.0,
        "1996": 48.0,
        "1998": 49.0,
        "1999": 42.0,
        "2000": 45.0,
        "2001": 50.0,
        "2002": 48.0,
        "2003": 51.0,
        "2004": 54.0,
        "2005": 64.0,
        "2006": 57.0,
        "2007": 59.0,
        "2009": 56.0,
        "2013": 61.3
      }
    },
    {
      "class": "ALL CLASSES",
      "prodn_practice": "NON-IRRIGATED",
      "raw": {},
      "short_desc": "SOYBEANS, NON-IRRIGATED - YIELD, MEASURED IN BU / ACRE",
      "suppressed": {},
      "unit": "BU / ACRE",
      "util_practice": "ALL UTILIZATION PRACTICES",
      "values": {
        "1960": 31.0,
        "1961": 27.0,
        "1962": 28.0,
        "1963": 28.0,
        "1964": 22.0,
        "1965": 23.0,
        "1966": 32.0,
        "1967": 27.0,
        "1968": 29.0,
        "1969": 36.0,
        "1970": 26.0,
        "1971": 30.0,
        "1972": 33.0,
        "1973": 32.0,
        "1974": 26.0,
        "1975": 25.0,
        "1976": 24.0,
        "1977": 32.0,
        "1978": 36.0,
        "1979": 33.0,
        "1980": 32.0,
        "1981": 38.0,
        "1982": 35.0,
        "1983": 32.0,
        "1984": 24.0,
        "1985": 36.0,
        "1986": 41.0,
        "1987": 35.0,
        "1988": 29.0,
        "1989": 30.0,
        "1990": 38.0,
        "1991": 39.0,
        "1992": 43.0,
        "1993": 36.0,
        "1994": 47.0,
        "1995": 26.6,
        "1996": 44.0,
        "1997": 41.0,
        "1998": 43.0,
        "1999": 42.0,
        "2000": 35.0,
        "2001": 40.0,
        "2002": 34.0,
        "2003": 33.0,
        "2004": 48.1,
        "2005": 47.0,
        "2006": 49.0,
        "2007": 50.0,
        "2009": 52.0,
        "2013": 46.3
      }
    }
  ],
  "state": {
    "alpha": "NE",
    "fips": "31",
    "name": "NEBRASKA"
  }
}
