{
  "commodity": {
    "desc": "SOYBEANS",
    "slug": "soybeans"
  },
  "county": {
    "code": "025",
    "name": "HARFORD"
  },
  "schema_version": 2,
  "series": [
    {
      "canonical": true,
      "class": "ALL CLASSES",
      "prodn_practice": "ALL PRODUCTION PRACTICES",
      "raw": {},
      "short_desc": "SOYBEANS - YIELD, MEASURED IN BU / ACRE",
      "suppressed": {},
      "unit": "BU / ACRE",
      "util_practice": "ALL UTILIZATION PRACTICES",
      "values": {
        "1969": 33.0,
        "1970": 26.4,
        "1971": 30.9,
        "1972": 23.0,
        "1973": 24.0,
        "1974": 27.9,
        "1975": 27.0,
        "1976": 25.0,
        "1977": 26.8,
        "1978": 33.0,
        "1979": 31.0,
        "1980": 24.0,
        "1981": 33.0,
        "1982": 31.0,
        "1983": 23.0,
        "1984": 33.0,
        "1985": 35.0,
        "1986": 25.0,
        "1987": 35.0,
        "1988": 34.0,
        "1989": 34.0,
        "1990": 38.9,
        "1991": 33.0,
        "1992": 34.0,
        "1993": 36.3,
        "1994": 33.3,
        "1995": 29.2,
        "1996": 36.7,
        "1997": 29.2,
        "1998": 40.0,
        "1999": 31.8,
        "2000": 41.0,
        "2001": 36.0,
        "2002": 32.4,
        "2003": 40.9,
        "2004": 47.0,
        "2005": 36.9,
        "2006": 41.9,
        "2007": 33.8,
        "2008": 37.0,
        "2009": 48.0,
        "2010": 43.1,
        "2011": 45.6,
        "2012": 51.6,
        "2013": 52.9,
        "2014": 49.6,
        "2015": 47.1,
        "2016": 53.0,
        "2017": 51.5,
        "2018": 47.3,
        "2019": 50.0,
        "2020": 52.8,
        "2021": 57.7,
        "2022": 49.7,
        "2024": 51.9
      }
    },
    {
      "class": "ALL CLASSES",
      "prodn_practice": "ALL PRODUCTION PRACTICES",
      "raw": {},
      "short_desc": "SOYBEANS - YIELD, MEASURED IN BU / NET PLANTED ACRE",
      "suppressed": {},
      "unit": "BU / NET PLANTED ACRE",
      "util_practice": "ALL UTILIZATION PRACTICES",
      "values": {
        "1975": 26.0,
        "1976": 24.0
      }
    }
  ],
  "state": {
    "alpha": "MD",
    "fips": "24",
    "name": "MARYLAND"
  }
}
