{
  "commodity": {
    "desc": "SOYBEANS",
    "slug": "soybeans"
  },
  "county": {
    "code": "053",
    "name": "CURRITUCK"
  },
  "schema_version": 2,
  "series": [
    {
      "canonical": true,
      "class": "ALL CLASSES",
      "prodn_practice": "ALL PRODUCTION PRACTICES",
      "raw": {},
      "short_desc": "SOYBEANS - YIELD, MEASURED IN BU / ACRE",
      "suppressed": {},
      "unit": "BU / ACRE",
      "util_practice": "ALL UTILIZATION PRACTICES",
      "values": {
        "1972": 27.0,
        "1973": 32.0,
        "1974": 26.0,
        "1975": 27.0,
        "1976": 32.0,
        "1977": 31.0,
        "1978": 28.0,
        "1979": 29.0,
        "1980": 28.0,
        "1981": 31.0,
        "1982": 30.0,
        "1983": 28.0,
        "1984": 33.0,
        "1985": 35.0,
        "1986": 30.0,
        "1987": 28.0,
        "1988": 32.0,
        "1989": 26.0,
        "1990": 32.0,
        "1991": 33.0,
        "1992": 31.0,
        "1993": 31.0,
        "1994": 35.0,
        "1995": 36.0,
        "1996": 35.0,
        "1997": 34.0,
        "1998": 32.0,
        "1999": 19.0,
        "2000": 40.0,
        "2001": 35.0,
        "2002": 35.0,
        "2003": 33.0,
        "2004": 40.0,
        "2005": 39.0,
        "2006": 32.0,
        "2007": 37.0,
        "2008": 36.5,
        "2009": 41.5,
        "2010": 40.8,
        "2011": 35.0,
        "2012": 41.4,
        "2013": 45.5,
        "2014": 46.7,
        "2015": 39.2,
        "2017": 37.9,
        "2018": 37.6,
        "2019": 44.0,
        "2020": 35.1,
        "2021": 45.3,
        "2022": 41.7,
        "2023": 40.3,
        "2024": 51.9,
        "2025": 47.5
      }
    }
  ],
  "state": {
    "alpha": "NC",
    "fips": "37",
    "name": "NORTH CAROLINA"
  }
}
