{
  "commodity": {
    "desc": "SOYBEANS",
    "slug": "soybeans"
  },
  "county": {
    "code": "063",
    "name": "CAMP"
  },
  "schema_version": 2,
  "series": [
    {
      "canonical": true,
      "class": "ALL CLASSES",
      "prodn_practice": "ALL PRODUCTION PRACTICES",
      "raw": {},
      "short_desc": "SOYBEANS - YIELD, MEASURED IN BU / ACRE",
      "suppressed": {},
      "unit": "BU / ACRE",
      "util_practice": "ALL UTILIZATION PRACTICES",
      "values": {
        "1975": 25.8,
        "1989": 23.8
      }
    },
    {
      "class": "ALL CLASSES",
      "prodn_practice": "NON-IRRIGATED",
      "raw": {},
      "short_desc": "SOYBEANS, NON-IRRIGATED - YIELD, MEASURED IN BU / ACRE",
      "suppressed": {},
      "unit": "BU / ACRE",
      "util_practice": "ALL UTILIZATION PRACTICES",
      "values": {
        "1989": 23.8
      }
    }
  ],
  "state": {
    "alpha": "TX",
    "fips": "48",
    "name": "TEXAS"
  }
}
