{
  "commodity": {
    "desc": "SOYBEANS",
    "slug": "soybeans"
  },
  "county": {
    "code": "019",
    "name": "BUCHANAN"
  },
  "schema_version": 2,
  "series": [
    {
      "canonical": true,
      "class": "ALL CLASSES",
      "prodn_practice": "ALL PRODUCTION PRACTICES",
      "raw": {},
      "short_desc": "SOYBEANS - YIELD, MEASURED IN BU / ACRE",
      "suppressed": {},
      "unit": "BU / ACRE",
      "util_practice": "ALL UTILIZATION PRACTICES",
      "values": {
        "1927": 14.5,
        "1928": 18.0,
        "1929": 13.9,
        "1930": 14.5,
        "1931": 12.3,
        "1932": 15.5,
        "1933": 13.1,
        "1934": 12.5,
        "1935": 16.2,
        "1936": 9.6,
        "1937": 13.9,
        "1938": 19.2,
        "1939": 19.5,
        "1940": 19.0,
        "1941": 13.9,
        "1942": 14.5,
        "1943": 18.4,
        "1944": 16.8,
        "1945": 16.3,
        "1946": 17.4,
        "1947": 13.7,
        "1948": 18.9,
        "1949": 17.8,
        "1950": 16.6,
        "1951": 16.4,
        "1952": 21.4,
        "1953": 19.6,
        "1954": 24.1,
        "1955": 17.2,
        "1956": 21.6,
        "1957": 24.7,
        "1958": 24.5,
        "1959": 24.3,
        "1960": 21.9,
        "1961": 24.9,
        "1962": 24.1,
        "1963": 28.5,
        "1964": 26.2,
        "1965": 26.9,
        "1966": 26.4,
        "1967": 27.7,
        "1968": 29.7,
        "1969": 29.8,
        "1970": 32.8,
        "1971": 28.9,
        "1972": 34.0,
        "1973": 32.0,
        "1974": 30.8,
        "1975": 32.8,
        "1976": 32.1,
        "1977": 37.2,
        "1978": 38.1,
        "1979": 38.1,
        "1980": 39.8,
        "1981": 38.1,
        "1982": 36.2,
        "1983": 36.2,
        "1984": 31.0,
        "1985": 34.6,
        "1986": 43.9,
        "1987": 47.7,
        "1988": 27.4,
        "1989": 36.8,
        "1990": 45.4,
        "1991": 47.3,
        "1992": 44.8,
        "1993": 36.4,
        "1994": 51.8,
        "1995": 44.3,
        "1996": 45.6,
        "1997": 48.2,
        "1998": 53.1,
        "1999": 49.1,
        "2000": 45.6,
        "2001": 44.9,
        "2002": 49.3,
        "2003": 25.9,
        "2004": 45.2,
        "2005": 53.6,
        "2006": 52.6,
        "2007": 50.7,
        "2008": 46.5,
        "2009": 44.0,
        "2010": 50.5,
        "2011": 55.1,
        "2012": 47.1,
        "2013": 49.2,
        "2014": 49.5,
        "2015": 57.7,
        "2016": 60.2,
        "2017": 55.9,
        "2018": 57.2,
        "2019": 55.2,
        "2020": 56.7,
        "2021": 63.4,
        "2022": 65.0,
        "2023": 51.8,
        "2024": 59.9
      }
    }
  ],
  "state": {
    "alpha": "IA",
    "fips": "19",
    "name": "IOWA"
  }
}
