{
  "commodity": {
    "desc": "SOYBEANS",
    "slug": "soybeans"
  },
  "county": {
    "code": "037",
    "name": "EDGEFIELD"
  },
  "schema_version": 2,
  "series": [
    {
      "canonical": true,
      "class": "ALL CLASSES",
      "prodn_practice": "ALL PRODUCTION PRACTICES",
      "raw": {},
      "short_desc": "SOYBEANS - YIELD, MEASURED IN BU / ACRE",
      "suppressed": {},
      "unit": "BU / ACRE",
      "util_practice": "ALL UTILIZATION PRACTICES",
      "values": {
        "1972": 13.3,
        "1973": 18.2,
        "1974": 21.2,
        "1975": 21.9,
        "1976": 17.3,
        "1977": 22.6,
        "1978": 20.5,
        "1979": 24.6,
        "1980": 16.8,
        "1981": 14.8,
        "1982": 21.5,
        "1983": 18.3,
        "1984": 17.5,
        "1985": 20.8,
        "1986": 16.8,
        "1987": 17.8,
        "1988": 24.4,
        "1989": 21.9,
        "1990": 15.8,
        "1991": 24.6,
        "1992": 20.6,
        "1993": 12.7,
        "1994": 33.0,
        "1995": 26.0,
        "1996": 28.0,
        "1997": 14.0,
        "1998": 11.0,
        "1999": 16.0,
        "2000": 20.0,
        "2001": 10.0,
        "2003": 29.0,
        "2004": 23.0,
        "2005": 19.0,
        "2006": 30.0,
        "2007": 11.0,
        "2008": 13.0,
        "2011": 11.5,
        "2012": 25.0,
        "2013": 23.0,
        "2014": 24.9,
        "2015": 24.6,
        "2017": 27.6,
        "2018": 31.3,
        "2019": 20.0
      }
    }
  ],
  "state": {
    "alpha": "SC",
    "fips": "45",
    "name": "SOUTH CAROLINA"
  }
}
