{
  "commodity": {
    "desc": "WHEAT",
    "slug": "wheat"
  },
  "county": {
    "code": "071",
    "name": "CHAMBERS"
  },
  "schema_version": 2,
  "series": [
    {
      "canonical": true,
      "class": "ALL CLASSES",
      "prodn_practice": "ALL PRODUCTION PRACTICES",
      "raw": {},
      "short_desc": "WHEAT - YIELD, MEASURED IN BU / ACRE",
      "suppressed": {},
      "unit": "BU / ACRE",
      "util_practice": "ALL UTILIZATION PRACTICES",
      "values": {
        "1976": 16.9,
        "1977": 14.4,
        "1985": 25.0,
        "1988": 17.5,
        "1989": 7.5,
        "1999": 31.1,
        "2000": 28.0,
        "2001": 40.0,
        "2002": 20.0,
        "2004": 26.0
      }
    },
    {
      "class": "ALL CLASSES",
      "prodn_practice": "ALL PRODUCTION PRACTICES",
      "raw": {},
      "short_desc": "WHEAT - YIELD, MEASURED IN BU / NET PLANTED ACRE",
      "suppressed": {},
      "unit": "BU / NET PLANTED ACRE",
      "util_practice": "ALL UTILIZATION PRACTICES",
      "values": {
        "1976": 14.8,
        "1977": 10.1,
        "1985": 2.8,
        "1988": 10.8,
        "1989": 6.9
      }
    },
    {
      "class": "ALL CLASSES",
      "prodn_practice": "NON-IRRIGATED",
      "raw": {},
      "short_desc": "WHEAT, NON-IRRIGATED - YIELD, MEASURED IN BU / ACRE",
      "suppressed": {},
      "unit": "BU / ACRE",
      "util_practice": "ALL UTILIZATION PRACTICES",
      "values": {
        "1976": 16.9,
        "1977": 14.4,
        "1985": 25.0,
        "1988": 17.5,
        "1989": 7.5,
        "1999": 31.1,
        "2000": 28.0,
        "2001": 40.0,
        "2002": 20.0,
        "2004": 26.0
      }
    },
    {
      "class": "ALL CLASSES",
      "prodn_practice": "NON-IRRIGATED",
      "raw": {},
      "short_desc": "WHEAT, NON-IRRIGATED - YIELD, MEASURED IN BU / NET PLANTED ACRE",
      "suppressed": {},
      "unit": "BU / NET PLANTED ACRE",
      "util_practice": "ALL UTILIZATION PRACTICES",
      "values": {
        "1976": 14.8,
        "1977": 10.1,
        "1985": 2.8,
        "1988": 10.8,
        "1989": 6.9
      }
    },
    {
      "class": "ALL CLASSES",
      "prodn_practice": "NON-IRRIGATED, CONTINUOUS CROP",
      "raw": {},
      "short_desc": "WHEAT, NON-IRRIGATED, CONTINUOUS CROP - YIELD, MEASURED IN BU / ACRE",
      "suppressed": {},
      "unit": "BU / ACRE",
      "util_practice": "ALL UTILIZATION PRACTICES",
      "values": {
        "1985": 25.0,
        "1988": 17.5,
        "1989": 7.5
      }
    },
    {
      "class": "ALL CLASSES",
      "prodn_practice": "NON-IRRIGATED, CONTINUOUS CROP",
      "raw": {},
      "short_desc": "WHEAT, NON-IRRIGATED, CONTINUOUS CROP - YIELD, MEASURED IN BU / NET PLANTED ACRE",
      "suppressed": {},
      "unit": "BU / NET PLANTED ACRE",
      "util_practice": "ALL UTILIZATION PRACTICES",
      "values": {
        "1985": 2.8,
        "1988": 10.8,
        "1989": 6.9
      }
    },
    {
      "class": "WINTER",
      "prodn_practice": "ALL PRODUCTION PRACTICES",
      "raw": {},
      "short_desc": "WHEAT, WINTER - YIELD, MEASURED IN BU / ACRE",
      "suppressed": {},
      "unit": "BU / ACRE",
      "util_practice": "ALL UTILIZATION PRACTICES",
      "values": {
        "1976": 16.9,
        "1977": 14.4,
        "1985": 25.0,
        "1988": 17.5,
        "1989": 7.5,
        "1999": 31.1,
        "2000": 28.0,
        "2001": 40.0,
        "2002": 20.0,
        "2004": 26.0
      }
    },
    {
      "class": "WINTER",
      "prodn_practice": "ALL PRODUCTION PRACTICES",
      "raw": {},
      "short_desc": "WHEAT, WINTER - YIELD, MEASURED IN BU / NET PLANTED ACRE",
      "suppressed": {},
      "unit": "BU / NET PLANTED ACRE",
      "util_practice": "ALL UTILIZATION PRACTICES",
      "values": {
        "1976": 14.8,
        "1977": 10.1,
        "1985": 2.8,
        "1988": 10.8,
        "1989": 6.9
      }
    },
    {
      "class": "WINTER",
      "prodn_practice": "NON-IRRIGATED",
      "raw": {},
      "short_desc": "WHEAT, WINTER, NON-IRRIGATED - YIELD, MEASURED IN BU / ACRE",
      "suppressed": {},
      "unit": "BU / ACRE",
      "util_practice": "ALL UTILIZATION PRACTICES",
      "values": {
        "1976": 16.9,
        "1977": 14.4,
        "1985": 25.0,
        "1988": 17.5,
        "1989": 7.5,
        "1999": 31.1,
        "2000": 28.0,
        "2001": 40.0,
        "2002": 20.0,
        "2004": 26.0
      }
    },
    {
      "class": "WINTER",
      "prodn_practice": "NON-IRRIGATED",
      "raw": {},
      "short_desc": "WHEAT, WINTER, NON-IRRIGATED - YIELD, MEASURED IN BU / NET PLANTED ACRE",
      "suppressed": {},
      "unit": "BU / NET PLANTED ACRE",
      "util_practice": "ALL UTILIZATION PRACTICES",
      "values": {
        "1976": 14.8,
        "1977": 10.1,
        "1985": 2.8,
        "1988": 10.8,
        "1989": 6.9
      }
    },
    {
      "class": "WINTER",
      "prodn_practice": "NON-IRRIGATED, CONTINUOUS CROP",
      "raw": {},
      "short_desc": "WHEAT, WINTER, NON-IRRIGATED, CONTINUOUS CROP - YIELD, MEASURED IN BU / ACRE",
      "suppressed": {},
      "unit": "BU / ACRE",
      "util_practice": "ALL UTILIZATION PRACTICES",
      "values": {
        "1985": 25.0,
        "1988": 17.5,
        "1989": 7.5
      }
    },
    {
      "class": "WINTER",
      "prodn_practice": "NON-IRRIGATED, CONTINUOUS CROP",
      "raw": {},
      "short_desc": "WHEAT, WINTER, NON-IRRIGATED, CONTINUOUS CROP - YIELD, MEASURED IN BU / NET PLANTED ACRE",
      "suppressed": {},
      "unit": "BU / NET PLANTED ACRE",
      "util_practice": "ALL UTILIZATION PRACTICES",
      "values": {
        "1985": 2.8,
        "1988": 10.8,
        "1989": 6.9
      }
    }
  ],
  "state": {
    "alpha": "TX",
    "fips": "48",
    "name": "TEXAS"
  }
}
